{"$schema":"http://json-schema.org/draft-07/schema#","title":"Caller-supplied GitHub observations; not live API verification","type":"object","required":["repository","revision","observed_at","facts"],"additionalProperties":false,"properties":{"repository":{"type":"string","pattern":"^[A-Za-z0-9_.-]+/[A-Za-z0-9_.-]+$"},"revision":{"type":["string","null"]},"observed_at":{"type":"string","pattern":"^[0-9]{4}-[0-9]{2}-[0-9]{2}T"},"facts":{"type":"array","items":{"type":"object","required":["key","status","value","source"],"additionalProperties":false,"properties":{"key":{"type":"string","minLength":1},"status":{"enum":["observed","unknown"]},"value":{"type":"boolean"},"source":{"type":"string","pattern":"^https://"},"reason":{"type":"string"}}}}}}
